{
  "$schema": "http://json-schema.org/draft-07/schema#",
  "title": "NDA Document Schema",
  "description": "JSON Schema for NDA documents in NLD format",
  "type": "object",
  "required": ["metadata", "structure", "relationships", "verification"],
  "properties": {
    "metadata": {
      "type": "object",
      "required": ["type", "version", "created", "entities"],
      "properties": {
        "type": {
          "type": "string",
          "enum": ["NDA"]
        },
        "version": {
          "type": "string",
          "pattern": "^\\d+\\.\\d+\\.\\d+$"
        },
        "created": {
          "type": "string",
          "format": "date-time"
        },
        "entities": {
          "type": "array",
          "minItems": 2,
          "items": {
            "type": "object",
            "required": ["id", "name", "role"],
            "properties": {
              "id": {
                "type": "string"
              },
              "name": {
                "type": "string"
              },
              "role": {
                "type": "string"
              }
            }
          }
        },
        "jurisdiction": {
          "type": "string"
        }
      }
    },
    "structure": {
      "type": "object",
      "required": ["sections"],
      "properties": {
        "sections": {
          "type": "array",
          "items": {
            "type": "object",
            "required": ["id", "title", "content"],
            "properties": {
              "id": {
                "type": "string"
              },
              "title": {
                "type": "string"
              },
              "content": {
                "type": "string"
              }
            }
          }
        },
        "items": {
          "type": "array",
          "items": {
            "type": "object",
            "required": ["id", "type"],
            "properties": {
              "id": {
                "type": "string"
              },
              "type": {
                "type": "string"
              },
              "value": {}
            }
          }
        },
        "definitions": {
          "type": "array",
          "items": {
            "type": "object",
            "required": ["term", "definition"],
            "properties": {
              "term": {
                "type": "string"
              },
              "definition": {
                "type": "string"
              }
            }
          }
        }
      }
    },
    "relationships": {
      "type": "object",
      "properties": {
        "dependencies": {
          "type": "array",
          "items": {
            "type": "object",
            "required": ["source", "target", "type"],
            "properties": {
              "source": {
                "type": "string"
              },
              "target": {
                "type": "string"
              },
              "type": {
                "type": "string"
              }
            }
          }
        },
        "references": {
          "type": "array",
          "items": {
            "type": "object",
            "required": ["source", "target", "type"],
            "properties": {
              "source": {
                "type": "string"
              },
              "target": {
                "type": "string"
              },
              "type": {
                "type": "string"
              }
            }
          }
        },
        "conditions": {
          "type": "array",
          "items": {
            "type": "object",
            "required": ["id", "predicate", "effect"],
            "properties": {
              "id": {
                "type": "string"
              },
              "predicate": {
                "type": "string"
              },
              "effect": {
                "type": "string"
              }
            }
          }
        }
      }
    },
    "verification": {
      "type": "object",
      "properties": {
        "signatures": {
          "type": "array",
          "items": {
            "type": "object",
            "required": ["signerId", "date", "value"],
            "properties": {
              "signerId": {
                "type": "string"
              },
              "date": {
                "type": "string",
                "format": "date-time"
              },
              "value": {
                "type": "string"
              }
            }
          }
        },
        "timestamps": {
          "type": "array",
          "items": {
            "type": "object",
            "required": ["date", "value"],
            "properties": {
              "date": {
                "type": "string",
                "format": "date-time"
              },
              "value": {
                "type": "string"
              }
            }
          }
        },
        "attestations": {
          "type": "array",
          "items": {
            "type": "object",
            "required": ["attesterId", "date", "statement"],
            "properties": {
              "attesterId": {
                "type": "string"
              },
              "date": {
                "type": "string",
                "format": "date-time"
              },
              "statement": {
                "type": "string"
              }
            }
          }
        }
      }
    }
  }
}